Name_English,Name_Wylie_Tibetan,Name_Tibetan,Name_Chinese,Dates,Description_English,Description_Tibetan,Description_Chinese,Transmission_Mode,Lineage,Received_Teachings_From,Gave_Teachings_To,Incarnation_Of,Family_Received_From,Eminated as,Position_Date
"Tromgé Choktrul Arik Rinpoché",,,,1905-1988,Student of Khenchen Ngawang Palzangpo,,,Aural,Vimalamitra,"Khenchen Ngawang Palzangpo (Khenpo Ngaga)","Khen Lama Rinpoché Achuk; Chagdud Tulku Padma Gargyi Wangchuk",,,,1905
"Khen Rinpoché Lekshé Jorden",,,,1900-2000,20th century student of Khenchen Ngawang Palzangpo,,,Aural,Vimalamitra,"Khenchen Ngawang Palzangpo (Khenpo Ngaga)",,,,,1900
"Khenchen Nuden Khyentsei Lodro",,,,1900-2000,20th century student of Khenchen Ngawang Palzangpo,,,Aural,Vimalamitra,"Khenchen Ngawang Palzangpo (Khenpo Ngaga)",,,,,1900
"Khenchen Yizhin Norbu Tupten Gyaltsen Özer",,,,1880-1980,19th-20th century student of Khenchen Ngawang Palzangpo,,,Aural,Vimalamitra,"Khenchen Ngawang Palzangpo (Khenpo Ngaga)",,,,,1880
"Golok Khenchen Munsel",,,,1916-1993,Student of Khenchen Ngawang Palzangpo,,,Aural,Vimalamitra,"Khenchen Ngawang Palzangpo (Khenpo Ngaga)","Choktrul Garwang Nyima",,,,1916
"Golok Lama Garchö",,,,1900-2000,20th century student of Khenchen Ngawang Palzangpo,,,Aural,Vimalamitra,"Khenchen Ngawang Palzangpo (Khenpo Ngaga)",,,,,1900
"Choktrul Orgyen Chemchok",,,,1915-2000,Student of Khenchen Ngawang Palzangpo,,,Aural,Vimalamitra,"Khenchen Ngawang Palzangpo (Khenpo Ngaga)","Choktrul Sang-ngak Tendzin",,,,1915
"Trakya Lama Rinpoché Palden",,,,1910-1990,Student of Khenchen Ngawang Palzangpo,,,Aural,Vimalamitra,"Khenchen Ngawang Palzangpo (Khenpo Ngaga)",,,,,1910
"Polu Khen Rinpoché Dorjé",,,,1897-1970,Student of Khenchen Ngawang Palzangpo,,,Aural,Vimalamitra,"Khenchen Ngawang Palzangpo (Khenpo Ngaga)",,,,,1897
"Taklung Tsetrul Rinpoché",,,,1926-,Student of Khenchen Ngawang Palzangpo,,,Aural,Vimalamitra,"Khenchen Ngawang Palzangpo (Khenpo Ngaga)",,,,,1926
"Chatral Rinpoché Sanjé Dorjé",,,,1913-,Student of Khenchen Ngawang Palzangpo,,,Aural,Vimalamitra,"Khenchen Ngawang Palzangpo (Khenpo Ngaga)","Dudjom Yangsi",,,,1913
"Tersé Chimé Rinpoché",,,,1900-2000,20th century student of Khenchen Ngawang Palzangpo,,,Aural,Vimalamitra,"Khenchen Ngawang Palzangpo (Khenpo Ngaga)",,,,,1900
"Lama Rinpoché Orgyen Rigdzin",,,,1900-1960,Student of Khenchen Ngawang Palzangpo,,,Aural,Vimalamitra,"Khenchen Ngawang Palzangpo (Khenpo Ngaga)",,,,,1900
"Lungtrul Shedrup Tenpai Nyima",,,,1920-,Student of Khenchen Ngawang Palzangpo,,,Aural,Vimalamitra,"Khenchen Ngawang Palzangpo (Khenpo Ngaga)","Khen Ngawang Palzang Yangsi Rinpoché; Choktrul Nyima Gyaltsen Rinpoché; Dragyab Lama Choden Rinpoché; Jokhang Choktrul Rinpoché; Nyoshul Khenpo Jamyang Dorjé",,,,1920
"Choktrul Nyima Gyaltsen Rinpoché",,,,1945-,Student of Lungtrul Shedrup Tenpai Nyima,,,Aural,Vimalamitra,"Lungtrul Shedrup Tenpai Nyima",,,,,1945
"Dragyab Lama Choden Rinpoché",,,,1920-2020,20th century student of Lungtrul Shedrup Tenpai Nyima,,,Aural,Vimalamitra,"Lungtrul Shedrup Tenpai Nyima",,,,,1920
"Jokhang Choktrul Rinpoché",,,,1920-2020,20th century student of Lungtrul Shedrup Tenpai Nyima,,,Aural,Vimalamitra,"Lungtrul Shedrup Tenpai Nyima",,,,,1920
"Nyoshul Khenpo Jamyang Dorjé",,,,1931-1999,Student of Lungtrul Shedrup Tenpai Nyima,,,Aural,Vimalamitra,"Lungtrul Shedrup Tenpai Nyima",,,,,1931
"Choktrul Sang-ngak Tendzin (Tulku Sang-ngak)",,,,1952-,Student of Choktrul Orgyen Chemchok,,,Aural,Vimalamitra,"Choktrul Orgyen Chemchok",,,,,1952
"Choktrul Garwang Nyima",,,,1940-,20th century student of Golok Khenchen Munsel,,,Aural,Vimalamitra,"Golok Khenchen Munsel",,,,,1940
"Khen Lama Rinpoché Achuk",,,,1920-,20th century student of Tromgé Choktrul Arik Rinpoché,,,Aural,Vimalamitra,"Tromgé Choktrul Arik Rinpoché",,,,,1920
"Chagdud Tulku Padma Gargyi Wangchuk",,,,1930-2002,Student of Tromgé Choktrul Arik Rinpoché,,,Aural,Vimalamitra,"Tromgé Choktrul Arik Rinpoché",,,,,1930
"Dartang Choktrul Chökyi Dawa Rinpoché",,,,1894-1959,Student of 2nd Palyul Drupwang Pema Norbu,,,Aural,Vimalamitra,"2nd Palyul Drupwang Pema Norbu, Rigdzin Kunzang Shedrupa",,,,,1894
"3rd Palyul Drupwang Pema Norbu, Jigmé Tupten Shedrup Chokyi Drayang (Kyabjé Penor Rinpoché)",,,,1932-,Student of 2nd Palyul Drupwang Pema Norbu,,,Aural,Vimalamitra,"2nd Palyul Drupwang Pema Norbu, Rigdzin Kunzang Shedrupa",,,,,1932
"Khenchen Jigmé Puntsok",,,,1933-2004,Student of Changma Khenchen Tupten Chöpel,,,Aural,Vimalamitra,"Changma Khenchen Tupten Chöpel",,,,,1933
"Dergé Lama Kunga Palden",,,,1850-1950,19th-20th century student of Orgyen Tendzin Norbu,,,Aural,Vimalamitra,"Orgyen Tendzin Norbu","Choktrul Lozang Tendzin",,,,1850
"Zhenga Dorjé Chang Zhenpen Chökyi Nangwa",,,,1871-1927,Student of Orgyen Tendzin Norbu,,,Aural,Vimalamitra,"Orgyen Tendzin Norbu","Palpung Tai Situ Rinpoché Pema Wangchok Gyalpo; Bo Gangkar Rinpoché; Nyarong Guru Tulku; Drukpa Geshé Tenpa Rinchen; Zurmang Khenchen Pema Namgyal; Khenchen Gönpo; Nyoshul Khenchen Ngawang Palzang Rinpoché; Tuksé Serkha Chodrak; Rahor Palden Chökyi Drakpa; Khunu Rinpoché Tendzin Gyaltsen; Tuksé Doring Choktrul Rinpoché",,,,1871
"Choktrul Lozang Tendzin",,,,1880-1980,19th-20th century student of Dergé Lama Kunga Palden,,,Aural,Vimalamitra,"Dergé Lama Kunga Palden","Apang Terchen Orgyen Trinlé Lingpa",,,,1880
"Apang Terchen Orgyen Trinlé Lingpa",,,,1895-1945,Treasure revealer, student of Choktrul Lozang Tendzin,,,Aural,Vimalamitra,"Choktrul Lozang Tendzin","Jangchub Dorjé",,,1895
"Jangchub Dorjé",,,,1920-2000,20th century student of Apang Terchen,,,Aural,Vimalamitra,"Apang Terchen Orgyen Trinlé Lingpa",,,,,1920
"Palpung Tai Situ Rinpoché Pema Wangchok Gyalpo",,,,1886-1952,Student of Zhenga Dorjé Chang,,,Aural,Vimalamitra,"Zhenga Dorjé Chang Zhenpen Chökyi Nangwa","1st Dzigar Kongtrul Rinpoché; Zurmang Khenchen Pema Namgyal",,,,1886
"Bo Gangkar Rinpoché (Karma Shedrup Chökyi Seng-gé)",,,,1892-1957,Student of Zhenga Dorjé Chang,,,Aural,Vimalamitra,"Zhenga Dorjé Chang Zhenpen Chökyi Nangwa",,,,,1892
"Nyarong Guru Tulku",,,,1900-2000,20th century student of Zhenga Dorjé Chang,,,Aural,Vimalamitra,"Zhenga Dorjé Chang Zhenpen Chökyi Nangwa",,,,,1900
"Drukpa Geshé Tenpa Rinchen",,,,1900-2000,20th century student of Zhenga Dorjé Chang,,,Aural,Vimalamitra,"Zhenga Dorjé Chang Zhenpen Chökyi Nangwa",,,,,1900
"Zurmang Khenchen Pema Namgyal",,,,1900-2000,20th century student of Zhenga Dorjé Chang and Palpung Tai Situ,,,Aural,Vimalamitra,"Zhenga Dorjé Chang Zhenpen Chökyi Nangwa; Palpung Tai Situ Rinpoché Pema Wangchok Gyalpo","Zurmang Tenga Rinpoché",,,,1900
"Khenchen Gönpo",,,,1899-1959,Student of Zhenga Dorjé Chang,,,Aural,Vimalamitra,"Zhenga Dorjé Chang Zhenpen Chökyi Nangwa",,,,,1899
"Nyoshul Khenchen Ngawang Palzang Rinpoché",,,,1900-2000,20th century student of Zhenga Dorjé Chang,,,Aural,Vimalamitra,"Zhenga Dorjé Chang Zhenpen Chökyi Nangwa",,,,,1900
"Tuksé Serkha Chodrak",,,,1850-1950,19th-20th century student of Zhenga Dorjé Chang,,,Aural,Vimalamitra,"Zhenga Dorjé Chang Zhenpen Chökyi Nangwa",,,,,1850
"Rahor Palden Chökyi Drakpa",,,,1800-1901,Student of Zhenga Dorjé Chang,,,Aural,Vimalamitra,"Zhenga Dorjé Chang Zhenpen Chökyi Nangwa",,,,,1800
"Khunu Rinpoché Tendzin Gyaltsen",,,,1854-1977,Student of Zhenga Dorjé Chang,,,Aural,Vimalamitra,"Zhenga Dorjé Chang Zhenpen Chökyi Nangwa",,,,,1854
"Tuksé Doring Choktrul Rinpoché",,,,1900-2000,20th century student of Zhenga Dorjé Chang,,,Aural,Vimalamitra,"Zhenga Dorjé Chang Zhenpen Chökyi Nangwa",,,,,1900
"1st Dzigar Kongtrul Rinpoché",,,,1901-1963,Student of Palpung Tai Situ,,,Aural,Vimalamitra,"Palpung Tai Situ Rinpoché Pema Wangchok Gyalpo",,,,,1901
"Zurmang Tenga Rinpoché",,,,1920-2020,20th century student of Zurmang Khenchen Pema Namgyal,,,Aural,Vimalamitra,"Zurmang Khenchen Pema Namgyal",,,,,1920
"Orgyen Chöjé",,,,1320-1400,14th century student of Longchen Rabjampa,,,Aural,Vimalamitra,"Longchen Rabjampa",,,,,1320
"Guru Ösel Rangdrol",,,,1320-1400,14th century student of Longchen Rabjampa,,,Aural,Vimalamitra,"Longchen Rabjampa",,,,,1320
"Tulku Paljor Gyaltsen",,,,1320-1400,14th century student of Longchen Rabjampa,,,Aural,Vimalamitra,"Longchen Rabjampa",,,,,1320
"Dokhampa Dengom Chödrak Zangpo",,,,1320-1400,14th century student of Longchen Rabjampa,,,Aural,Vimalamitra,"Longchen Rabjampa",,,,,1320